0,"https://doi.org/10.1109/pccc.1996.493672"," @article{Huse, title={Prediction-based routing for cell-switched networks}, url={http://dx.doi.org/10.1109/pccc.1996.493672}, DOI={10.1109/pccc.1996.493672}, journal={Conference Proceedings of the 1996 IEEE Fifteenth Annual International Phoenix Conference on Computers and Communications}, publisher={IEEE}, author={Huse, S.M. and Meliksetian, D.S. and Chen, C.Y.R.} } ","Huse, S.M., Meliksetian, D.S., Chen, C.Y.R., n.d. Prediction-based routing for cell-switched networks. Conference Proceedings of the 1996 IEEE Fifteenth Annual International Phoenix Conference on Computers and Communications. https://doi.org/10.1109/pccc.1996.493672 ","elsevier-harvard"
0,"https://doi.org/10.1080/07328300008544146"," @article{Sztaricskai_2000, title={Synthesis and Conformational Studies of Unnatural Pyrimidine Nucleosides}, volume={19}, ISSN={1532-2327}, url={http://dx.doi.org/10.1080/07328300008544146}, DOI={10.1080/07328300008544146}, number={9}, journal={Journal of Carbohydrate Chemistry}, publisher={Informa UK Limited}, author={Sztaricskai, Ferenc and Csorvási, Andrea and Horváth, András and Batta, Gyula and Dinya, Zoltán}, year={2000}, month=jan, pages={1223–1233} } ","Sztaricskai, Ferenc, et al. “Synthesis and Conformational Studies of Unnatural Pyrimidine Nucleosides.” Journal of Carbohydrate Chemistry, vol. 19, no. 9, Jan. 2000, pp. 1223–33. Crossref, https://doi.org/10.1080/07328300008544146. ","mla"
0,"https://doi.org/10.3403/30111069"," @article{1, url={http://dx.doi.org/10.3403/30111069}, DOI={10.3403/30111069}, publisher={BSI British Standards} } ","Thermoplastics Pipes and Associated Fittings for Hot and Cold Water for Domestic Purposes and Heating Installations in Buildings. Crossref, https://doi.org/10.3403/30111069. ","mla"
0,"https://doi.org/10.6027/aa7000c9-en"," @article{Carl_n_2019, title={Are Climate Policies in the Nordic Countries Cost-Effective?}, url={http://dx.doi.org/10.6027/aa7000c9-en}, DOI={10.6027/aa7000c9-en}, publisher={Nordic Council of Ministers}, author={Carlén, Björn and Kriström, Bengt}, year={2019}, month=may } ","Carlén, Björn, and Bengt Kriström. Are Climate Policies in the Nordic Countries Cost-Effective? May 2019. Crossref, https://doi.org/10.6027/aa7000c9-en. ","mla"
0,"https://doi.org/10.1080/03601234.2020.1733369"," @article{Tiago_2020, title={Simultaneous and direct determination of glyphosate and AMPA in water samples from the hydroponic cultivation of eucalyptus seedlings using HPLC-ICP-MS/MS}, volume={55}, ISSN={1532-4109}, url={http://dx.doi.org/10.1080/03601234.2020.1733369}, DOI={10.1080/03601234.2020.1733369}, number={6}, journal={Journal of Environmental Science and Health, Part B}, publisher={Informa UK Limited}, author={Tiago, João P. F. and Sicupira, Lázaro C. and Barros, Rodrigo E. and de Pinho, Gevany P. and Silvério, Flaviano O.}, year={2020}, month=feb, pages={558–565} } ","Tiago, J. P. F., L. C. Sicupira, R. E. Barros, G. P. de Pinho & F. O. Silvério, 2020. Simultaneous and direct determination of glyphosate and AMPA in water samples from the hydroponic cultivation of eucalyptus seedlings using HPLC-ICP-MS/MS. Journal of Environmental Science and Health, Part B, 55: 558–565. Informa UK Limited. ","ecoscience"
0,"https://doi.org/10.1111/j.1365-2818.1912.tb01005.x"," @article{1912, volume={32}, ISSN={0368-3974}, url={http://dx.doi.org/10.1111/j.1365-2818.1912.tb01005.x}, DOI={10.1111/j.1365-2818.1912.tb01005.x}, number={6}, journal={Journal of the Royal Microscopical Society}, publisher={Wiley}, year={1912}, month=dec, pages={671–672} } ","PROCEEDINGS OF THE SOCIETY, 1912. . Journal of the Royal Microscopical Society, 32: 671–672. Wiley. ","ecoscience"
0,"https://doi.org/10.1093/hmg/2.2.143"," @article{Mutirangura_1993, title={Multiplex PCR of three dinucleotide repeats in the Prader-Willi/Angelman critical region (15q11–q13): molecular diagnosis and mechanism of uniparental disomy}, volume={2}, ISSN={1460-2083}, url={http://dx.doi.org/10.1093/hmg/2.2.143}, DOI={10.1093/hmg/2.2.143}, number={2}, journal={Human Molecular Genetics}, publisher={Oxford University Press (OUP)}, author={Mutirangura, Apiwat and Greenberg, Frank and Butler, Merlin G. and Malcolm, Sue and Nicholls, Robert D. and Chakravarti, Aravinda and Ledbetter, David H.}, year={1993}, pages={143–151} } ","Mutirangura, A., F. Greenberg, M. G. Butler, S. Malcolm, R. D. Nicholls, A. Chakravarti & D. H. Ledbetter, 1993. Multiplex PCR of three dinucleotide repeats in the Prader-Willi/Angelman critical region (15q11–q13): molecular diagnosis and mechanism of uniparental disomy. Human Molecular Genetics, 2: 143–151. Oxford University Press (OUP). ","ecoscience"
0,"https://doi.org/10.33422/icsha.2021.06.402"," @article{Oparinde_2021, title={Violence Against Women: Exploring Discursive Resistance in the Frames of Gender Violence in South Africa}, url={http://dx.doi.org/10.33422/icsha.2021.06.402}, DOI={10.33422/icsha.2021.06.402}, journal={Proceedings of ‏The International Conference on Social Sciences, Humanities and Arts}, publisher={GLOBALKS}, author={Oparinde, Kunle}, year={2021}, month=jun } ","Oparinde, K., 2021. Violence Against Women: Exploring Discursive Resistance in the Frames of Gender Violence in South Africa. Proceedings of ‏The International Conference on Social Sciences, Humanities and Arts. https://doi.org/10.33422/icsha.2021.06.402 ","elsevier-harvard"
0,"https://doi.org/10.7312/drin94372-004"," @article{1933, ISBN={9780231898355}, url={http://dx.doi.org/10.7312/drin94372-004}, DOI={10.7312/drin94372-004}, journal={This Troubled World}, publisher={Columbia University Press}, year={1933}, month=dec, pages={83–108} } ","The Individual Soul, 1933. . This Troubled World: 83–108. Columbia University Press. ","ecoscience"
0,"https://doi.org/10.1079/9780851995175.0224"," @article{P_rez_2001, title={An increased hindgut fermentation promoted major changes on the VFA profile but not on the total VFA concentration or the digesta contents.}, ISBN={9780851997209}, url={http://dx.doi.org/10.1079/9780851995175.0224}, DOI={10.1079/9780851995175.0224}, journal={Digestive physiology of pigs. Proceedings of the 8th Symposium, Swedish University of Agricultural Sciences, Uppsala, Sweden, 20-22 June 2000}, publisher={CABI Publishing}, author={Pérez, J. F. and Morales, J. and Baucells, M. D. and Gasa, J.}, year={2001}, month=jan, pages={224–226} } ","Pérez, J. F., Morales, J., Baucells, M. D., & Gasa, J. (2001). An increased hindgut fermentation promoted major changes on the VFA profile but not on the total VFA concentration or the digesta contents. Digestive Physiology of Pigs. Proceedings of the 8th Symposium, Swedish University of Agricultural Sciences, Uppsala, Sweden, 20-22 June 2000, 224–226. https://doi.org/10.1079/9780851995175.0224 ","apa"
0,"https://doi.org/10.1007/978-1-59745-194-9_23"," @article{Li_2008, title={Delivery of DNA into Tumors}, ISBN={9781597451949}, ISSN={1940-6029}, url={http://dx.doi.org/10.1007/978-1-59745-194-9_23}, DOI={10.1007/978-1-59745-194-9_23}, journal={Electroporation Protocols}, publisher={Humana Press}, author={Li, Shulin}, year={2008}, pages={311–318} } ","Li, S., 2008. Delivery of DNA into Tumors. Electroporation Protocols: 311–318. Humana Press. ","ecoscience"
0,"https://doi.org/10.1016/j.nanoen.2018.12.074"," @article{Han_2019, title={Self-powered visualization system by conjunction of photovoltaic effect and contact-electrification}, volume={57}, ISSN={2211-2855}, url={http://dx.doi.org/10.1016/j.nanoen.2018.12.074}, DOI={10.1016/j.nanoen.2018.12.074}, journal={Nano Energy}, publisher={Elsevier BV}, author={Han, Linhong and Zhao, Xuan and Ma, Mingyuan and Gao, Fangfang and Xun, Xiaochen and Liao, Qingliang and Zhang, Zheng and Kang, Zhuo and Zhang, Yue}, year={2019}, month=mar, pages={528–534} } ","Han, L., X. Zhao, M. Ma, F. Gao, X. Xun, Q. Liao, Z. Zhang, Z. Kang & Y. Zhang, 2019. Self-powered visualization system by conjunction of photovoltaic effect and contact-electrification. Nano Energy, 57: 528–534. Elsevier BV. ","ecoscience"
0,"https://doi.org/10.1016/j.jtbi.2007.05.036"," @article{G_sieniec_2007, title={Randomized probe selection algorithm for microarray design}, volume={248}, ISSN={0022-5193}, url={http://dx.doi.org/10.1016/j.jtbi.2007.05.036}, DOI={10.1016/j.jtbi.2007.05.036}, number={3}, journal={Journal of Theoretical Biology}, publisher={Elsevier BV}, author={Gąsieniec, Leszek and Li, Cindy Y. and Sant, Paul and Wong, Prudence W.H.}, year={2007}, month=oct, pages={512–521} } ","Gąsieniec, Leszek, et al. “Randomized Probe Selection Algorithm for Microarray Design.” Journal of Theoretical Biology, vol. 248, no. 3, Oct. 2007, pp. 512–21. Crossref, https://doi.org/10.1016/j.jtbi.2007.05.036. ","mla"
0,"https://doi.org/10.1142/s0218127495000776"," @article{UHL_1995, title={CHAOTIC PHENOMENA IN AN ORDER 1 DPCM TRANSMISSION SYSTEM}, volume={05}, ISSN={1793-6551}, url={http://dx.doi.org/10.1142/s0218127495000776}, DOI={10.1142/s0218127495000776}, number={04}, journal={International Journal of Bifurcation and Chaos}, publisher={World Scientific Pub Co Pte Lt}, author={UHL, C. and FOURNIER-PRUNARET, D.}, year={1995}, month=aug, pages={1033–1070} } ","UHL, C. & D. FOURNIER-PRUNARET, 1995. CHAOTIC PHENOMENA IN AN ORDER 1 DPCM TRANSMISSION SYSTEM. International Journal of Bifurcation and Chaos, 05: 1033–1070. World Scientific Pub Co Pte Lt. ","ecoscience"
0,"https://doi.org/10.29007/j2z7"," @article{Gundu, title={IoT Security and Privacy: Turning on the Human Firewall in Smart Farming}, ISSN={2515-1762}, url={http://dx.doi.org/10.29007/j2z7}, DOI={10.29007/j2z7}, journal={Kalpa Publications in Computing}, publisher={EasyChair}, author={Gundu, Tapiwa and Maronga, Vimbai} } ","Gundu, Tapiwa, and Vimbai Maronga. “IoT Security and Privacy: Turning on the Human Firewall in Smart Farming.” Kalpa Publications in Computing. Crossref, https://doi.org/10.29007/j2z7. ","mla"
0,"https://doi.org/10.1016/0022-3093(91)90333-2"," @article{Struik_1991, title={Some problems in the non-linear viscoelasticity of amorphous glassy polymers}, volume={131–133}, ISSN={0022-3093}, url={http://dx.doi.org/10.1016/0022-3093(91)90333-2}, DOI={10.1016/0022-3093(91)90333-2}, journal={Journal of Non-Crystalline Solids}, publisher={Elsevier BV}, author={Struik, L.C.E.}, year={1991}, month=jun, pages={395–407} } ","Struik, L. C. E. “Some Problems in the Non-Linear Viscoelasticity of Amorphous Glassy Polymers.” Journal of Non-Crystalline Solids, vol. 131–133, June 1991, pp. 395–407. Crossref, https://doi.org/10.1016/0022-3093(91)90333-2. ","mla"
0,"https://doi.org/10.1063/1.4806868"," @article{Jiang_2013, title={Numerical simulation on shape distortion of superplastic forming Ti-6Al-4V cylinder}, ISSN={0094-243X}, url={http://dx.doi.org/10.1063/1.4806868}, DOI={10.1063/1.4806868}, journal={AIP Conference Proceedings}, publisher={AIP}, author={Jiang, Shao-song and Lu, Zhen and Li, Bai-ru and Wang, Guo-feng and Zhang, Kai-feng}, year={2013} } ","Jiang, S., Lu, Z., Li, B., Wang, G., Zhang, K., 2013. Numerical simulation on shape distortion of superplastic forming Ti-6Al-4V cylinder. AIP Conference Proceedings. https://doi.org/10.1063/1.4806868 ","elsevier-harvard"
0,"https://doi.org/10.1086/320241"," @article{Li_2001, title={Rossby Wave Instability of Thin Accretion Disks. III. Nonlinear Simulations}, volume={551}, ISSN={1538-4357}, url={http://dx.doi.org/10.1086/320241}, DOI={10.1086/320241}, number={2}, journal={The Astrophysical Journal}, publisher={American Astronomical Society}, author={Li, H. and Colgate, S. A. and Wendroff, B. and Liska, R.}, year={2001}, month=apr, pages={874–896} } ","Li, H., Colgate, S. A., Wendroff, B., & Liska, R. (2001). Rossby Wave Instability of Thin Accretion Disks. III. Nonlinear Simulations. The Astrophysical Journal, 551(2), 874–896. https://doi.org/10.1086/320241 ","apa"
0,"https://doi.org/10.1080/0969725x.2019.1684706"," @article{Guzm_n_2019, title={LAW AND B/ORDER}, volume={24}, ISSN={1469-2899}, url={http://dx.doi.org/10.1080/0969725x.2019.1684706}, DOI={10.1080/0969725x.2019.1684706}, number={6}, journal={Angelaki}, publisher={Informa UK Limited}, author={Guzmán, R. Andrés}, year={2019}, month=nov, pages={152–167} } ","Guzmán, R. Andrés. “LAW AND B/ORDER.” Angelaki, vol. 24, no. 6, Nov. 2019, pp. 152–67. Crossref, https://doi.org/10.1080/0969725x.2019.1684706. ","mla"
0,"https://doi.org/10.1016/j.jmrt.2020.09.039"," @article{Kim_2020, title={Analysis and modeling of uniaxial compressive creep of MMA-modified unsaturated polyester polymer concrete}, volume={9}, ISSN={2238-7854}, url={http://dx.doi.org/10.1016/j.jmrt.2020.09.039}, DOI={10.1016/j.jmrt.2020.09.039}, number={6}, journal={Journal of Materials Research and Technology}, publisher={Elsevier BV}, author={Kim, Kwan-Kyu and Urgessa, Girum S. and Yeon, Jung Heum}, year={2020}, month=nov, pages={12773–12782} } ","Kim, K.-K., G. S. Urgessa & J. H. Yeon, 2020. Analysis and modeling of uniaxial compressive creep of MMA-modified unsaturated polyester polymer concrete. Journal of Materials Research and Technology, 9: 12773–12782. Elsevier BV. ","ecoscience"
0,"https://doi.org/10.1016/s1096-7192(02)00142-7"," @article{Wistuba_2002, title={Transgenic mouse models and germ cell transplantation: two excellent tools for the analysis of genes regulating male fertility}, volume={77}, ISSN={1096-7192}, url={http://dx.doi.org/10.1016/s1096-7192(02)00142-7}, DOI={10.1016/s1096-7192(02)00142-7}, number={1–2}, journal={Molecular Genetics and Metabolism}, publisher={Elsevier BV}, author={Wistuba, Joachim and Schlatt, Stefan}, year={2002}, month=sep, pages={61–67} } ","Wistuba, J., & Schlatt, S. (2002). Transgenic mouse models and germ cell transplantation: two excellent tools for the analysis of genes regulating male fertility. Molecular Genetics and Metabolism, 77(1–2), 61–67. https://doi.org/10.1016/s1096-7192(02)00142-7 ","apa"
0,"https://doi.org/10.1103/physrevb.48.9921"," @article{Preosti_1993, title={Minimum-energy vortex configurations in anisotropic superconductors}, volume={48}, ISSN={1095-3795}, url={http://dx.doi.org/10.1103/physrevb.48.9921}, DOI={10.1103/physrevb.48.9921}, number={13}, journal={Physical Review B}, publisher={American Physical Society (APS)}, author={Preosti, G. and Muzikar, Paul}, year={1993}, month=oct, pages={9921–9924} } ","Preosti, G. & P. Muzikar, 1993. Minimum-energy vortex configurations in anisotropic superconductors. Physical Review B, 48: 9921–9924. American Physical Society (APS). ","ecoscience"
0,"https://doi.org/10.1002/jlb.53.2.151"," @article{Watanabe_1993, title={Regulation by dietary essential fatty acid balance of tumor necrosis factor production in mouse macrophages}, volume={53}, ISSN={1938-3673}, url={http://dx.doi.org/10.1002/jlb.53.2.151}, DOI={10.1002/jlb.53.2.151}, number={2}, journal={Journal of Leukocyte Biology}, publisher={Oxford University Press (OUP)}, author={Watanabe, Shiro and Onozaki, Kikuo and Yamamoto, Shunsuke and Okuyama, Harumi}, year={1993}, month=feb, pages={151–156} } ","Watanabe, Shiro, et al. “Regulation by Dietary Essential Fatty Acid Balance of Tumor Necrosis Factor Production in Mouse Macrophages.” Journal of Leukocyte Biology, vol. 53, no. 2, Feb. 1993, pp. 151–56. Crossref, https://doi.org/10.1002/jlb.53.2.151. ","mla"
0,"https://doi.org/10.1111/j.1365-2494.1947.tb00759.x"," @article{Williams_1947, title={THE GERMINATION AND ESTABLISHMENT OF RED CLOVER UNDER CONDITIONS OF DIRECT RE‐SEEDING}, volume={2}, ISSN={1365-2494}, url={http://dx.doi.org/10.1111/j.1365-2494.1947.tb00759.x}, DOI={10.1111/j.1365-2494.1947.tb00759.x}, number={1}, journal={Grass and Forage Science}, publisher={Wiley}, author={Williams, Watkin}, year={1947}, month=mar, pages={30–44} } ","Williams, Watkin. “THE GERMINATION AND ESTABLISHMENT OF RED CLOVER UNDER CONDITIONS OF DIRECT RE‐SEEDING.” Grass and Forage Science, vol. 2, no. 1, Mar. 1947, pp. 30–44. Portico, Crossref, https://doi.org/10.1111/j.1365-2494.1947.tb00759.x. ","mla"
0,"https://doi.org/10.1016/j.hlpt.2021.100578"," @article{Najjar_2021, title={The adoption level of electronic medical records in hebron hospitals based on the electronic medical record adoption model (EMRAM)}, volume={10}, ISSN={2211-8837}, url={http://dx.doi.org/10.1016/j.hlpt.2021.100578}, DOI={10.1016/j.hlpt.2021.100578}, number={4}, journal={Health Policy and Technology}, publisher={Elsevier BV}, author={Najjar, Arwa and Amro, Belal and Macedo, Mário}, year={2021}, month=dec, pages={100578} } ","Najjar, A., Amro, B., Macedo, M., 2021. The adoption level of electronic medical records in hebron hospitals based on the electronic medical record adoption model (EMRAM). Health Policy and Technology 10, 100578. https://doi.org/10.1016/j.hlpt.2021.100578 ","elsevier-harvard"
0,"https://doi.org/10.4028/www.scientific.net/msf.419-422.837"," @article{Thakur_2003, title={Some Studies on Mg Alloy Reinforced with Ceramic Discontinuous Phases}, volume={419–422}, ISSN={1662-9752}, url={http://dx.doi.org/10.4028/www.scientific.net/msf.419-422.837}, DOI={10.4028/www.scientific.net/msf.419-422.837}, journal={Materials Science Forum}, publisher={Trans Tech Publications, Ltd.}, author={Thakur, Sanjay K. and Dhindaw, Brij and Hort, Norbert and Kainer, Karl Ulrich}, year={2003}, month=mar, pages={837–844} } ","Thakur, S. K., Dhindaw, B., Hort, N., & Kainer, K. U. (2003). Some Studies on Mg Alloy Reinforced with Ceramic Discontinuous Phases. Materials Science Forum, 419–422, 837–844. https://doi.org/10.4028/www.scientific.net/msf.419-422.837 ","apa"
0,"https://doi.org/10.1016/j.cej.2023.147883"," @article{Huang_2024, title={Enhanced peroxymonosulfate activation by highly magnetic FeCo-CoFe2O4 biphasic fibers for norfloxacin degradation}, volume={480}, ISSN={1385-8947}, url={http://dx.doi.org/10.1016/j.cej.2023.147883}, DOI={10.1016/j.cej.2023.147883}, journal={Chemical Engineering Journal}, publisher={Elsevier BV}, author={Huang, Ziting and Zhang, Xiaoqian and Zhu, Ze and Guo, Zhenfeng and Wang, Xinqiang and Zhu, Luyi and Zhang, Guanghui and Liu, Benxue and Xu, Dong}, year={2024}, month=jan, pages={147883} } ","Huang, Z., Zhang, X., Zhu, Z., Guo, Z., Wang, X., Zhu, L., Zhang, G., Liu, B., Xu, D., 2024. Enhanced peroxymonosulfate activation by highly magnetic FeCo-CoFe2O4 biphasic fibers for norfloxacin degradation. Chemical Engineering Journal 480, 147883. https://doi.org/10.1016/j.cej.2023.147883 ","elsevier-harvard"
0,"https://doi.org/10.1080/07313568908909400"," @article{RAMA_RAO_1989, title={A NEW ROBUST ALGORITHM FOR ESTIMATING THE STATE OF A POWER SYSTEM}, volume={16}, ISSN={0731-356X}, url={http://dx.doi.org/10.1080/07313568908909400}, DOI={10.1080/07313568908909400}, number={6}, journal={Electric Machines &amp; Power Systems}, publisher={Informa UK Limited}, author={RAMA RAO, N. and MURALIKRISHNA, G.}, year={1989}, month=jan, pages={431–439} } ","RAMA RAO, N., MURALIKRISHNA, G., 1989. A NEW ROBUST ALGORITHM FOR ESTIMATING THE STATE OF A POWER SYSTEM. Electric Machines &amp; Power Systems 16, 431–439. https://doi.org/10.1080/07313568908909400 ","elsevier-harvard"
0,"https://doi.org/10.1017/s1727719100003993"," @article{Shen_2004, title={Atomistic Analysis of Nano-Scale Crystal Plasticity in Thin Metal Films}, volume={20}, ISSN={1811-8216}, url={http://dx.doi.org/10.1017/s1727719100003993}, DOI={10.1017/s1727719100003993}, number={1}, journal={Journal of Mechanics}, publisher={Oxford University Press (OUP)}, author={Shen, Y.-L. and Leger, R. W.}, year={2004}, month=mar, pages={1–11} } ","Shen, Y.-L. & R. W. Leger, 2004. Atomistic Analysis of Nano-Scale Crystal Plasticity in Thin Metal Films. Journal of Mechanics, 20: 1–11. Oxford University Press (OUP). ","ecoscience"
0,"https://doi.org/10.1162/tacl_a_00339"," @article{Ye_2020, title={Sketch-Driven Regular Expression Generation from Natural Language and Examples}, volume={8}, ISSN={2307-387X}, url={http://dx.doi.org/10.1162/tacl_a_00339}, DOI={10.1162/tacl_a_00339}, journal={Transactions of the Association for Computational Linguistics}, publisher={MIT Press - Journals}, author={Ye, Xi and Chen, Qiaochu and Wang, Xinyu and Dillig, Isil and Durrett, Greg}, year={2020}, month=dec, pages={679–694} } ","Ye, X., Chen, Q., Wang, X., Dillig, I., & Durrett, G. (2020). Sketch-Driven Regular Expression Generation from Natural Language and Examples. Transactions of the Association for Computational Linguistics, 8, 679–694. https://doi.org/10.1162/tacl_a_00339 ","apa"
0,"https://doi.org/10.1046/j.1525-1438.2002.00020.x"," @article{Greenlee_2002, title={Quantitation of CMV by real‐time PCR in transfusable RBC units}, volume={42}, ISSN={1537-2995}, url={http://dx.doi.org/10.1046/j.1525-1438.2002.00020.x}, DOI={10.1046/j.1525-1438.2002.00020.x}, number={4}, journal={Transfusion}, publisher={Wiley}, author={Greenlee, Deborah J. and Fan, Hongxin and Lawless, Kathleen and Harrison, Chantal R. and Gulley, Margaret L.}, year={2002}, month=apr, pages={403–408} } ","Greenlee, Deborah J., et al. “Quantitation of CMV by Real‐time PCR in Transfusable RBC Units.” Transfusion, vol. 42, no. 4, Apr. 2002, pp. 403–08. Portico, Crossref, https://doi.org/10.1046/j.1525-1438.2002.00020.x. ","mla"
0,"https://doi.org/10.1016/j.biopha.2020.110940"," @article{He_2021, title={Pharmacokinetics and biotransformation investigation in beagle dog of active compounds from naoxintong capsule}, volume={133}, ISSN={0753-3322}, url={http://dx.doi.org/10.1016/j.biopha.2020.110940}, DOI={10.1016/j.biopha.2020.110940}, journal={Biomedicine &amp; Pharmacotherapy}, publisher={Elsevier BV}, author={He, Yan and Su, Weiwei and He, Xiang and Chen, Taobin and Zeng, Xuan and Yan, Zenghao and Zhang, Weijian and Yang, Wei and Guo, Jianmin and Wu, Hao}, year={2021}, month=jan, pages={110940} } ","He, Yan, et al. “Pharmacokinetics and Biotransformation Investigation in Beagle Dog of Active Compounds from Naoxintong Capsule.” Biomedicine &amp; Pharmacotherapy, vol. 133, Jan. 2021, p. 110940. Crossref, https://doi.org/10.1016/j.biopha.2020.110940. ","mla"
0,"https://doi.org/10.1093/shm/15.2.187"," @article{Bonah_2002, title={“Experimental Rage”: The Development of Medical Ethics and the Genesis of Scientific Facts. Ludwik Fleck: An Answer to the Crisis of Modern Medicine in Interwar Germany?: Society for the Social History of Medicine Millennium Prize Essay 2000}, volume={15}, ISSN={1477-4666}, url={http://dx.doi.org/10.1093/shm/15.2.187}, DOI={10.1093/shm/15.2.187}, number={2}, journal={Social History of Medicine}, publisher={Oxford University Press (OUP)}, author={Bonah, C.}, year={2002}, month=aug, pages={187–207} } ","Bonah, C., 2002. “Experimental Rage”: The Development of Medical Ethics and the Genesis of Scientific Facts. Ludwik Fleck: An Answer to the Crisis of Modern Medicine in Interwar Germany?: Society for the Social History of Medicine Millennium Prize Essay 2000. Social History of Medicine, 15: 187–207. Oxford University Press (OUP). ","ecoscience"
0,"https://doi.org/10.1016/0167-7187(88)90004-5"," @article{Grout_1988, title={Employee buy-outs}, volume={6}, ISSN={0167-7187}, url={http://dx.doi.org/10.1016/0167-7187(88)90004-5}, DOI={10.1016/0167-7187(88)90004-5}, number={1}, journal={International Journal of Industrial Organization}, publisher={Elsevier BV}, author={Grout, Paul A. and Jewitt, Ian}, year={1988}, month=mar, pages={33–45} } ","Grout, P. A. & I. Jewitt, 1988. Employee buy-outs. International Journal of Industrial Organization, 6: 33–45. Elsevier BV. ","ecoscience"
0,"https://doi.org/10.3892/etm.2023.12180"," @article{Geng_2023, title={Knee osteoarthritis: Current status and research progress in treatment (Review)}, volume={26}, ISSN={1792-1015}, url={http://dx.doi.org/10.3892/etm.2023.12180}, DOI={10.3892/etm.2023.12180}, number={4}, journal={Experimental and Therapeutic Medicine}, publisher={Spandidos Publications}, author={Geng, Ruizhi and Li, Jiayi and Yu, Chen and Zhang, Chaoqun and Chen, Fei and Chen, Jie and Ni, Haonan and Wang, Jiaxu and Kang, Kaiqiang and Wei, Ziqi and Xu, Yongqing and Jin, Tao}, year={2023}, month=aug } ","Geng, R., Li, J., Yu, C., Zhang, C., Chen, F., Chen, J., Ni, H., Wang, J., Kang, K., Wei, Z., Xu, Y., & Jin, T. (2023). Knee osteoarthritis: Current status and research progress in treatment (Review). Experimental and Therapeutic Medicine, 26(4). https://doi.org/10.3892/etm.2023.12180 ","apa"
0,"https://doi.org/10.1016/0016-5085(95)90640-1"," @article{Sababi_1995, title={Mucus and alkali secretion in the rat duodenum: Effects of indomethacin, Nω-Nitro-l-arginine, and luminal acid}, volume={109}, ISSN={0016-5085}, url={http://dx.doi.org/10.1016/0016-5085(95)90640-1}, DOI={10.1016/0016-5085(95)90640-1}, number={5}, journal={Gastroenterology}, publisher={Elsevier BV}, author={Sababi, Manaf and Nilsson, Evonne and Holm, Lena}, year={1995}, month=nov, pages={1526–1534} } ","Sababi, Manaf, et al. “Mucus and Alkali Secretion in the Rat Duodenum: Effects of Indomethacin, Nω-Nitro-l-Arginine, and Luminal Acid.” Gastroenterology, vol. 109, no. 5, Nov. 1995, pp. 1526–34. Crossref, https://doi.org/10.1016/0016-5085(95)90640-1. ","mla"
